{
  "digest": {
    "sha256": "e72878a8fe7374ccc97aec1ffab2f5642747b63a298bc2699ffdf6fefa9c09c1",
    "sha256_tlv_matches": true
  },
  "file_len": 4756,
  "format": "keelsign-inspect",
  "header": {
    "flags": {
      "names": [],
      "raw": 0,
      "unknown_bits": 0
    },
    "hdr_size": 512,
    "img_size": 1536,
    "load_addr": 0,
    "magic": 2532554813,
    "protect_tlv_size": 0,
    "version": {
      "build_num": 4,
      "major": 1,
      "minor": 2,
      "revision": 3,
      "string": "1.2.3+4"
    }
  },
  "key_ids": [
    "76d91a3bd3171a9a49a03660c2f4424d"
  ],
  "keyhashes": [],
  "protected": null,
  "schema_version": 1,
  "signatures": [
    {
      "area": "unprotected",
      "key_id": "76d91a3bd3171a9a49a03660c2f4424d",
      "keyhash": null,
      "kind": "lms-hss",
      "len": 2644,
      "lms": {
        "levels": 2,
        "lmots_types": [
          "LMOTS_SHA256_N32_W8",
          "LMOTS_SHA256_N32_W8"
        ],
        "lms_types": [
          "LMS_SHA256_M32_H5",
          "LMS_SHA256_M32_H5"
        ],
        "q": 0
      },
      "paired": null
    }
  ],
  "tlv_end": 4756,
  "trailing_bytes": 0,
  "unprotected": {
    "magic": 26887,
    "tlv_tot": 2708,
    "tlvs": [
      {
        "decoded": {
          "hash": "SHA-256",
          "matches_digest": true
        },
        "len": 32,
        "name": "SHA256",
        "type": 16,
        "type_hex": "0x0010",
        "value_hex": "e72878a8fe7374ccc97aec1ffab2f5642747b63a298bc2699ffdf6fefa9c09c1"
      },
      {
        "decoded": {
          "key_id": "76d91a3bd3171a9a49a03660c2f4424d"
        },
        "len": 16,
        "name": "KEELSIGN_KEY_ID",
        "type": 19360,
        "type_hex": "0x4ba0",
        "value_hex": "76d91a3bd3171a9a49a03660c2f4424d"
      },
      {
        "decoded": {
          "levels": 2,
          "lmots_types": [
            "LMOTS_SHA256_N32_W8",
            "LMOTS_SHA256_N32_W8"
          ],
          "lms_types": [
            "LMS_SHA256_M32_H5",
            "LMS_SHA256_M32_H5"
          ],
          "parameter_set": "LMS/HSS",
          "q": 0
        },
        "len": 2644,
        "name": "KEELSIGN_LMS_HSS_SIG",
        "type": 19363,
        "type_hex": "0x4ba3",
        "value_hex": "000000010000000000000004de95e44eda60b6466eabff1e9e66e13c357c1ac8587b63e91bdb49d5a9e93799b6d029842fb4374faa916ea50a84e9c463e2ee31a879eb0ad94b6831787d92956affc9d1b447635863b21335b82e598ec15a0ef1f063f2cbacc383844082e79f93acb59e75f3b07f372b99c2713d064a52b7e4adfad00b3cc3afc7a276198efa2a5c952ab1b7e906b554a27b01e75baaa2ae23c8f315bb924a5fe56df5bc133eb81183398048842a5289a0e22bb03f70eab0f2bfa5ea0673fcc461bb064e5526bb5fa461d843387c76af4b5a1eb1578893b7bf146ec7694876bf1fd0fff6b7d91e008f61a2c907a9929215e7a8483584967f1e2fe7e50e111fcb4f83b3243223411c1bd9c3bdef99d68956a67176756da01a6c33ebc4a7e4e8cfa5e2c161b9ec461bd79f29a484f65b138440938541b9181b564175596617d15b3dff4ca2781dde0e6ae294a8d8022e4aecdd12a78cc054efc69011942a18574da8b984aeb1b9ea2342e5150210c0f718148a085f563126e2a4c392d10fcfd08bf6ff2b8484cfd68012523d5c00802243f923314c3e8bf9b240ee7217e5ad40b650ff028c6533c977eb6a4fecea9d378fb167285be085760ad4a931b013be93be69c999fe7fe332d804a805cbaf820bc657d4dced23475665144d9297cdd4b694efd8d85949988c07972ae89b2c58a2eb5c41f50b97edf496dc538108b427422b1476dd0a7ef9e98c6de4f11b55bb96715944d34b29680563534f8d22bac0add15265f61bff1d6c93d3776069e978798f44892b23081c4648aa3954a08f007b261cbbe5b339d275ef4259d061cf376cd40335398236d0cd7c8f9c2cb06c6cf901be36ae7a58492e57b91c919d726e947e9dee6d451787d20ef0b94cfdfbf9d759b1aeaa87d96911fb32d151880c48b713627da7cf5b3afd757c8d48142e89d60616161cc0e359e3264635782c03f46479fbc7f4159b098b2a74b50e9c0f0f778b603673272b185abe5947739aeb5f610ac26842dde6619b7a36138bc2e4b8780bece109a135dfe30069b10c1eb7d78e167e75dc1237d580ddf925e2f2fcd63d367c39ce367409db9bad147dc83cd0331272ee2e8ac1cda3e11a11afafd5b33e90982bd022d8e78c58cbda270097a51c32a5fea9024d1f456fd71df7f606dd327f66cf775b39fe85c80b379b9a0f0336d6068ac535a20419328c08fbb3bbae8b08baf2e834aef038186b3358acb51baa3e8d22cf959cc87651bcb24d9eb47a096c11a0d9e51f198b31a46edb84780d7a4cf03f4b3fdb950cc97d1ea2d0f8c2cac31d4542314729b2b22aceb92a2d694c20a25a4459311cee61b6b1483b592c97e3a0f24fa20240954b3f2b2912fbeb2ec6eab697efae68f707a674f7662320626dfe726722b6f4b88add42a1d45e280a0fc163cc6f7619f256b2714123fedd8661f682138012a9c7eb93845b8ab1afacc8558fb39019eace03bcccfe84ea61f287e5b2ffc040edae80b437785970a77197e5770a76faf38f07d256646a5f2ddcd98f81996343099cb12663a5644bfbf232016716d8fb6897ba5fff2688c266c50bdb950665252500000005fb9eec017a2c99275e0b7662531122a78ebecf9062ea8bc6f63db34c5f6e25a60d569e780824c585ed0dc677068ef5a2532541e742780f52e7125ed9358b3afe5ca1595eca7884e28dd9ed11aaa0294a6efd979ff42e9a7f57f19dc2cc12c41731f3582e42f537169c6d4f7b4c5db59808e86bab974446e11ca22062c90895983d76419ac29bac626d5fd75e761b5dc89cad606ed9d7fe0f7305a64f5d8456aa0000000500000004332ef2ce1c82705dd6027b7651afdd62f6225e1454418d16bb4c7ceb1805613de244062f663e3f1eabc394a2bf21ba8500000000000000042532be9271b6556a617e1f59aca173cbf9d6b630116f05e674a1a4e3d79a1bc1b2819731a6b750bb78d444d65c07b9eeadfea173885428e84f409b55d6627ce34217e1a389d6d25bae644f3091fc65aac2792317bec753276390a2732d5b330df4145e28a6101ca4e32bc33880d736d74b78b04a1ef326f562a1c1ccab8954503662f473d5b240504a6ef699fafc856623a51a231e3e5a10766831319ab8b271c5cea60b647b493f383885d96d036451535ad631e917f6bb11b746c5f131966840e46e5e2c0d0e6d99f4032013ce99f2ebe0b98f21c93a4c2de49a1a36d5a66ec89fc1db62251f9e0e5e6dc21d217ba37ed23c768ec9bd4543ab56a1d774d6d3dc003cb6b2e51a65f2bc28f7ea66139d368468090d7427916158a47cc5b84b9610d50c15f28a02a14ec47789abe6e67ccce8d15f6b291ff8e7abd070ee63f2f328f811a31d6426d78458a61012aef878fea9cd649015b1dceb3dd7bf1edc93eea499677815ddb59bfb0387f57ff70ee02b05cfc5832b54f1284e76052543171d976ca01432416d09cb55717c3ceefbcbcc509f944c8cfbed50110553d707d7c1dcfa6789fb66b4d1fe2c15cfca86aef023ef530c5bec05096c089236638c857d088dd52a5eb9506dc36714028c52345e3f7dd0ee0f775396b30ab89ba8da73a6557d6f2db2327b0c41ad25027ecf714ca023511d85e226cc16b833ff02a4efa983b6d1a079c659a72f26749d2405b8391185b7e0505fbc1fafeab8ee8fecb320f727d8d1a75381a1c161a58bc4120cea85c9897fd570873ba9dba07002fb76aa2a1c2575120fbd448587e387112bbff9888ddd28143c759013daead1bd5fccdc561a2a83f906460d8dee02c978d444916366f319fda781dfc4102af82794adcc6826807aa12d182e2b23fd8a527eb37f18aba5eaf142282344e57a4eb8b74b3f60f850973e1d87ff9b5074cbd5955d4a5f94dead8ea54d551eab866a49c30d6ac0ace57b75d28b77eb57b4e55a23a6a2caa6f56c7ce8d572e1f77467db6588bd25f3b3825ff6466db7e814bae14d70ca8ccac39e52281ac61b36c03718f62699951e76f4966b5dbe454ec1b438c42a5502c58377e5ada4528f63d6e759ef1f3597adb6b82ea47d0131227723c4919dcfad62193cabf467b1d53ee0787ff339e1db48c3ae882c757be51822876722be4cc8a8829c9fbedc3afb7cff53f5f0f7e59c7c6cb3bb8768fb6a59f89e12e7fb28e466c99f545124078cc7723b10ce0499f5b8c95fff6498fe1a4b4bc72c6096a2fd71e5fe866206d9001aa3c9f57948e92ad5474fbc450708a9184ce019d15bf598fe2c941db6922507989e19f431368a035b16360828b1859dfc29dd25678d86b1f2e10e9883bf6513129c84bc0aaf4e6a13cb9ee29d449550aa13cf4685885f6c46f36503332510a519f386d31b8347a35962581e0c92efb82846026e4553cf7b4420255b1f235f1a84a1d2de023eacc426ccf7b242284ec7efe70ca519f80912b2424d1de49fe7d6f533dddeba0f995c6548216e0473ad45c288053e507ffd6bfcf5800b549b1a62da1544adb38b74000000050435e0409fecd33a91b4d484b8f141a4818cc371da54b3aa298a03462ca07fb1c1c0c7824753729a80bef88f73354bc6a88c8655f886ed0ccde38965df6b4bd9cd99058e1b688077802b163cd98a93abc317208a5aa290f31b8ae18c849cf7e76ba779c21128517029049676745722ceb72fb3ffcac1bd955c6fa944f59e43e613bd22f038b6c612ed8fd8879f777e496edbe90b7836c2942b483b4871e051ae"
      }
    ]
  }
}
