{
  "digest": {
    "sha256": "14bc390be01003e0c0a84e577c1156d8423f93b68337bcf0df0e9ffc189add83",
    "sha256_tlv_matches": true
  },
  "file_len": 5466,
  "format": "keelsign-inspect",
  "header": {
    "flags": {
      "names": [],
      "raw": 0,
      "unknown_bits": 0
    },
    "hdr_size": 512,
    "img_size": 1536,
    "load_addr": 0,
    "magic": 2532554813,
    "protect_tlv_size": 45,
    "version": {
      "build_num": 4,
      "major": 1,
      "minor": 2,
      "revision": 3,
      "string": "1.2.3+4"
    }
  },
  "key_ids": [
    "a602e37b4d644240d11cf33cbaccc553"
  ],
  "keyhashes": [],
  "protected": {
    "magic": 26888,
    "tlv_tot": 45,
    "tlvs": [
      {
        "decoded": {
          "security_counter": 7
        },
        "len": 4,
        "name": "SEC_CNT",
        "type": 80,
        "type_hex": "0x0050",
        "value_hex": "07000000"
      },
      {
        "decoded": null,
        "len": 29,
        "name": null,
        "type": 4256,
        "type_hex": "0x10a0",
        "value_hex": "6b65656c7369676e2d70726f7465637465642d76656e646f722d746c76"
      }
    ]
  },
  "schema_version": 1,
  "signatures": [
    {
      "area": "unprotected",
      "key_id": "a602e37b4d644240d11cf33cbaccc553",
      "keyhash": null,
      "kind": "ml-dsa-65",
      "len": 3309,
      "lms": null,
      "paired": null
    }
  ],
  "tlv_end": 5466,
  "trailing_bytes": 0,
  "unprotected": {
    "magic": 26887,
    "tlv_tot": 3373,
    "tlvs": [
      {
        "decoded": {
          "hash": "SHA-256",
          "matches_digest": true
        },
        "len": 32,
        "name": "SHA256",
        "type": 16,
        "type_hex": "0x0010",
        "value_hex": "14bc390be01003e0c0a84e577c1156d8423f93b68337bcf0df0e9ffc189add83"
      },
      {
        "decoded": {
          "key_id": "a602e37b4d644240d11cf33cbaccc553"
        },
        "len": 16,
        "name": "KEELSIGN_KEY_ID",
        "type": 19360,
        "type_hex": "0x4ba0",
        "value_hex": "a602e37b4d644240d11cf33cbaccc553"
      },
      {
        "decoded": {
          "parameter_set": "ML-DSA-65"
        },
        "len": 3309,
        "name": "KEELSIGN_MLDSA65_SIG",
        "type": 19362,
        "type_hex": "0x4ba2",
        "value_hex": "9e543bdcc42242aea85f3350596fac918bb6ab7d8bac8512347eb361538c26a35bc0e5be639d6839fb1bb150d9c1451b0f6f6d3d8abc2414f6bc3ec7123d91d9bfc89ed8d58a7bedb18d85fbe670832ecc44056f7d13a28e9f80db796267e1eae60134587c8cc58eec746f53cb5341dc21f96c05963f10eb5bedbb7f59c65bd567f2dbbf3793d0d8af75c4ebe64d4402b274a78f3cddba75c8436e0c12c1289a086f4ed33c3ced40c11f3e56704f55d10cb820148e9d96a183bf4c7cd9b0f41b94b772f5e2b1e514825aa5ac7cf3d9973d6458e29a0d3b5cad1fe539382599bfd768a569dfc35ad1b0d24674e4e73d98ade9267d732d902d9c4759373c28c7402797d507930f45fd256d431335fc57b85d6c9f4aa28c92a868e7f138c771d0bb50c3d2a7e0592e4456176995e4d25a64ca2396a0bc492c18a186fbc0f913cfa9a207720f0429c5a10ac1630ef5c76bd813bd391bffafe723809d6f61c7206fc9bf87b4bb207cad21d1dad1f6ab3e2d654627f1339830ab6d31cc52267e611e509ce8a88489fabb360e153f7f6e55488b49c0b50178fd608cc987df01ffa224affd60c5aa78fb50f2ebe7bf18f58b472e2d95719472e99b11432f1e5388e18903e3f595b44dd410273128619cb3c9aec0fb6f162572f4ef9ab8415642fc6a5c9cd5dddfe9b3f98f12268973cdeea19cb6ddad4edc3ce555d57d3dd64eacd20f42eed213bbee256b08b0b8d5a6c8c5a6afb031db00564c7cd7dc36868c96f3e36396de8c2a51928c16ac1f9e5d01547750d0e5f7e817e1feceeaa2b8a8a27a48a2423745a81acf6c98aa6eaa733fd66ae921549820343829c2780472185d74d3639fb3690d4aa27c031a170620ddbcbdd2f125ea5343afad3f3072020cf25e7d5adb3fb754e476bfac71eef18facf50a000c38162d7ee4c6ae8c6f36e085e32b409e4a5d9e2561f1cc2c417a1445a14fd8ebb67733d80131982db01cab980dc15041acd992cf67cdece8006d84fa4980ef7e7e6e13e660edc094165341b57e8eb3357b53195d019eee7bb7b2d755f8b45beea020f03c7d6d550d3811ac8fa520ff382dc8fdee3b2731b821ab794b2383cfd6229b7a877e637f70a8cb7b93744089d32935dd1f9722ece41c22166b4289a713ab7bc4b5c35896be79a9642325367e5f2a3a102d4c0cdb80c09123ea9a4db171e4150158012628e2685cf406e4e3dd372e96b44abbc19da41fe640f24a49cc2344aed8e729154ad4efcf7d07ba1257d49101ee7b60235e6fa6595d539d8a357bfe1828a2fb9a478221f2afb2329c7fa61bd16b2b8d118a8e118f93204d5b86cf6c42587f17d653cc2a38830fd9b067007aacf8300587a567052b43b5a4f4a8ca02b6dc114ee9f5da44c3367a16c6c52bf0b3381867728ff0015f3e5e3aea9edced90980b38aa85726b033af00208daaf6cb4a0693c5629284b77195bc8c6ee10095bccb593f6be52adc8f83d7eb8d5424014e3aab9174ef1e7d12a434b754f105d344935d8a090add58b895ff294ec07931a1ea0b33ad8d4807b07136c3e0bf5249cad2b4ce7bff6575c527a56f10f5a84354920535b7e6cb24f7c460f4c4499d844b375c92c6b4460b6024d4ada3792b4e1c5a1f848226eb3f99f2bd23c3632f0431bade160ace82e6e2cafc2944ac4a46df036fdd1c6f71710b96e6adb9fe58764100c5f13bd7f5092d83081b8a49d4489daf93afdef1858d3325d185d079d476ebc7e8ab1a9b389f0a5607b0c09907f8eb246ad0c035c530189031673905e649555bddd60d377ea695ede98afbe66d459ea2e4a3cafba8c48c18a436decdf2877d265225f49314c67c792c25c3f98f0d525fbae9ad5d8858e5cce8976046114190cf61e71fe2f559a4ee4cd32f764f899bfd0cffde1ce064a25814145f6e9d7be8d311928e39c0c04d0e4ceec37b0dbe253e7fd42eab03fcd07f012d4e7c0c0696d349be2342b7971a2771721c0af80c7c9c76bcbeaee6cfd735402199846ff3285f525e9be1b3fbfc10ee98f5ca49005b46e87dde0df74ffca6fb33d3926af310bd4da62a34940242195903b2c199c4a79c392e4ed0d23732bc9190cec693bd2573b5d04f245edf91671d10c0d2b7b7787897d9103ffa7819c9c579e0dc5bb4513db215ed8bdb4bedc7d5f649cb3fd743e23005ab9b3c591fcfb8d2628d0dd78e995a84f8a93fea979a774588dd566a7759cb7d116699c8e36c6a5b4c469e9035555820caeb738d0d7a187241a7abd3f1c2d81169217d76fe6fbc67c458d99b0de0046f8afedffe44c8ea9d870b73f558f1641ecbee79a717a776f0411501e9bb15fe10fa45b9172f0a7813d534c5590af4ce6b898ea8a666b54c0d46435dbb87dbe3e7d55ec508223bc47a14299e4896bae7af2795646db085cd6be67b3a90ab8993eb97387479f877e0d129ad77a2ce394406b7478f3441b98e5106d33babe09386411b207da941b91e783949c15216f749c2b2e4e73763f9a8a6a319e57c10e16743453207eb0c43af17f53ede9fefa30d2e2e355a5d62b8c53fe52396ad4533f3a4b5151e7df6c78b0cf53ff7d1761968835f29bbd34d28ce1f566124588efc397938c279c6b4dfcf06b94e2d2d77f0fb78eefec95e6974d3437171ab3c40956ae04cda4bd24672631b092dffda43d09d954eebf8ba6b6a199d919cc8041c30e3bde6b307fa5d40b934beaf0edbb7a4e04aba41d36d7e0ddc035f5405acefe81db2db7ee40ce3995492a1ebac8da2e90d0a8dbd9e214122d175152e0818e842c4d4cdb5d95f52864e136ef700f35b61670fed67367bfa218c8aec929b9fa684c1840c3aa9b2f226e55038d9526f86acdff0185289a3b1566b62e945dda854904ee61879e0bb66f62bfc25c01ad454f47017158df17851e5aa073180c5e8f7324d0df7653f4f20939cc969e9a7fadf3e280eb7aa4f322d1398e3f9a4916c0b1230c7bb99a25d348d7c89ce0e4402557ec235c28f917cc7a1812f77e18429c42f23fecd2cbf267f4e01f68cd7c88c80bf5e7a7d356c742857585d442a51259d2773228daf36e91de211d84a797d3bffb1f567c0a31ff961a7933c83709d52966369eff554825bd5110935478be9eb3e5d263e0942a2546d9e79429a32d8c79605c59bcd2a1aa7b9c8ae16bf60e59d920bd12488fd3a5f64504e61776a9b6fa7ce47c37aa90e3f2fb8218431d7acb90634a437507e913ce6d67412e9dbf94c47921f569dd0aa4e7e2886876224753065b671cba7ba79a3c797727c7bafd04559953c600e1469499a4948aaeae4c57a38a02a8013d4008bcd699b8607ae9a25920b12ceb3b19d21dd2d461536163b2e650d38989d72f374de7c23d60de7f460466aa55baa2dca49638e6e378ad824343c654d5c03dd516c5cfbe71c05f1a23e8d58f81eb52db58b522b1d7a80902562ea466a1813ef7128a246d046952628d37ead3068830ef554fcf14b97bf9e07375a070b9e601011c00ae53c9a8699818a3fb82eaeb355bad49c409bb2b9de54b06d5cf530a3052bdb62bad6f09dd1c06c0b85cd78ee41f0bc3309a689b0891852724767e3b8a76456cfd30315a9da6b4899c7d872cc07b1724fbde6c14e974780a616a8c30a8f6f7f143ef5a9132406217e1d771cc2f0950dedbe7d92bc4c763344e702ee63d6a1e2cc608888a1755b7396f95483b48b7766f0e5278b22b29405d852cfd96f22930450a1d7a0c788f373695c5eb13d9f9d0d4b279d26f244928c84eecda7ceac63b2ca1614e5d63714da37810b69fec007abd061ba1f9a0e6faf6be5bb966cd541427ad507d341159aa0856555cb8ce82d3989bdf58717df613cadf0df736caa46302e0ff6bd1a0aa721a5a4bf9559a7d262d8220425e2c96fbb6c3f9ea07f4e37ce013a20a919fa1d43f23148cdd28cf431b7d9245eb6bc5452bb17b1b52c20ba7102ca3950b6a7d0e97a0c0f37a8d8a4f512fac67ef333846bb023792bda07f2bf6fbdeba8a9acd8ed3a9e838c0d9af54238033e453615300890be6365ba45bff5c7ee85412c0813bd9f5f2a89b7ef742d987b9cc08eebd826bc4caa521f00ab3e06d939ce6427a48839c33ec21f73679ad71704c49864a87bae284777869fb8219341714426e70ede7a008439942539d0a4d22d03d21dbafddd1e81530e731508ad99c075065d05f7814bd55d1e06782dbb2cdbfd6f8dda3568557b550ff4e436cbcabed57f93ff856470a9926f23c64b571f5975968db54b0ac6df9ce35c7e1982196a2bfae48defdf76cb25fca919825fb2c98a15d54ba0e02717e88822db303ded70d72c86e194f57d37abfd1c0d6cdde283f5be7bf079b3707b8185662bf7a1e43a7e747a730abad358e1297a6d9b2b0b11177cca2fb79a3b472a831770d51b96e0f81c8d6420f56e1758f8868930567cf27dfd55ae79eb32f1086583b5bd6ed4062f84cfa68ed4cee3db407cd74eb09ea5722a2264bde0782aaa0bc04e1295aae644a9ffadd38f18b073f73accfa2f517fb3ee820515f0c444e61791f9ad47d84b0a7a4bd52a7d8317eee9abf89e11aecf9ad887ec6e3c2a2048cfd58adfb7f604604ed00094bd817353a4e55595f64898ba8000235378add0f224e777fbabbfc001d576e8a14171d252e5670d1d9e60000000000000000000000040f151d222c"
      }
    ]
  }
}
