{
  "digest": {
    "sha256": "0dc5794116bfeda410343a9029b7078fd48c1ace74b68c1af8bd3394643f5fb3",
    "sha256_tlv_matches": true
  },
  "file_len": 2507,
  "format": "keelsign-inspect",
  "header": {
    "flags": {
      "names": [],
      "raw": 0,
      "unknown_bits": 0
    },
    "hdr_size": 512,
    "img_size": 1536,
    "load_addr": 0,
    "magic": 2532554813,
    "protect_tlv_size": 123,
    "version": {
      "build_num": 4,
      "major": 1,
      "minor": 2,
      "revision": 3,
      "string": "1.2.3+4"
    }
  },
  "key_ids": [],
  "keyhashes": [
    "243b3b79ba834d441a927be78ec33fa759527030006ffa110815de892b3988af"
  ],
  "protected": {
    "magic": 26888,
    "tlv_tot": 123,
    "tlvs": [
      {
        "decoded": {
          "security_counter": 7
        },
        "len": 4,
        "name": "SEC_CNT",
        "type": 80,
        "type_hex": "0x0050",
        "value_hex": "07000000"
      },
      {
        "decoded": {
          "encoding": "CBOR"
        },
        "len": 91,
        "name": "BOOT_RECORD",
        "type": 96,
        "type_hex": "0x0060",
        "value_hex": "a501636170700465312e322e33055820243b3b79ba834d441a927be78ec33fa759527030006ffa110815de892b3988af06665348413235360258200000000000000000000000000000000000000000000000000000000000000000"
      },
      {
        "decoded": {
          "image_index": 1,
          "version": "1.2.3+4"
        },
        "len": 12,
        "name": "DEPENDENCY",
        "type": 64,
        "type_hex": "0x0040",
        "value_hex": "010000000102030004000000"
      }
    ]
  },
  "schema_version": 1,
  "signatures": [
    {
      "area": "unprotected",
      "key_id": null,
      "keyhash": "243b3b79ba834d441a927be78ec33fa759527030006ffa110815de892b3988af",
      "kind": "rsa2048-pss",
      "len": 256,
      "lms": null,
      "paired": true
    }
  ],
  "tlv_end": 2507,
  "trailing_bytes": 0,
  "unprotected": {
    "magic": 26887,
    "tlv_tot": 336,
    "tlvs": [
      {
        "decoded": {
          "hash": "SHA-256",
          "matches_digest": true
        },
        "len": 32,
        "name": "SHA256",
        "type": 16,
        "type_hex": "0x0010",
        "value_hex": "0dc5794116bfeda410343a9029b7078fd48c1ace74b68c1af8bd3394643f5fb3"
      },
      {
        "decoded": {
          "keyhash": "243b3b79ba834d441a927be78ec33fa759527030006ffa110815de892b3988af"
        },
        "len": 32,
        "name": "KEYHASH",
        "type": 1,
        "type_hex": "0x0001",
        "value_hex": "243b3b79ba834d441a927be78ec33fa759527030006ffa110815de892b3988af"
      },
      {
        "decoded": {
          "algorithm": "RSA-2048-PSS"
        },
        "len": 256,
        "name": "RSA2048_PSS",
        "type": 32,
        "type_hex": "0x0020",
        "value_hex": "0d299be7edfdf38bdd9d93a384f7ef5de0cdb3b8ed3a8198307e0ae77cd3ce02234ae759bded8720845632cc2123b4a7799b2dc0dd6789fbbff18bb9cec6168fc03a8194c7f7174602e24d58db24aba6addd168178a3fc8087c22ca356350767a94a1accaf650c54d42eb7bb5151c1999499c921ff880ff689a478cc5c91ad4efc5c4d754e17bf95f4cd55bc9a15289fd1cedcc46af8e5fabfadc7d29e686c6fac12dbff9dfcddc321a1878fed83f80ce2297f50337e395b0a800c716812517eac3e3d5e2401cc8ec6280c3cd439c0dad6e99b839def0170a3fcd7d3a21501024cb04a70c755f445802c2cae22adf7ffaa4d1bd07af2a749e5e28379b507b3a9"
      }
    ]
  }
}
